url,title,cook,description,directions,images,ingredients,prep,servings,total,timestamp
https://www.allrecipes.com/recipe/260452/greek-inspired-chicken-salad/,Greek-Style Chicken Salad,1 hr 30 mins,"This creamy Greek chicken salad with cucumbers, red onions, Greek yogurt, tomatoes, and feta cheese is perfect for a light and refreshing summer meal.","Step1: Place cucumbers in a colander; set onto a plate. Toss cucumbers with 1 teaspoon salt. Let rest to draw about liquid, about 30 minutes. Pat dry with paper towels. Step2: Place red onion and 1 cup cold water in a bowl. Let soak until the strong onion flavor is weakened, 5 to 10 minutes. Drain and rinse. Step3: Combine cucumbers, red onions, Greek yogurt, Kalamata olives, dill, vinegar, lemon juice, garlic, lemon zest, oregano, and black pepper in a bowl. Fold in chicken, feta cheese, and tomatoes. Cover with plastic wrap; refrigerate salad for at least 1 hour. Step4: Stir salad and serve on lettuce leaves.",https://www.allrecipes.com/thmb/k-V_zh5mTM_qFmD2M6Dea0M6Kew=/282x188/filters:no_upscale():max_bytes(150000):strip_icc():focal(1999x0:2001x2):format(webp)/7506757_Sarahs-Cool-Greek-Tortellini-Salad_Thedailygourmet_4x3-fb61b24755fc4ac7b7febef8d8d38aac.jpg,"1 cup diced English cucumbers, 1.25 teaspoons salt, divided, 2 tablespoons diced red onion, 1 cup Greek yogurt, 0.33333334326744 cup chopped Kalamata olives, 1.5 tablespoons chopped fresh dill, 2 teaspoons red wine vinegar, 2 teaspoons lemon juice, 1 teaspoon garlic, minced, 1 teaspoon lemon zest, 0.5 teaspoon dried oregano, 0.25 teaspoon ground black pepper, 3 cups diced cooked chicken, 0.75 cup crumbled feta cheese, 0.5 cup diced seeded plum tomatoes, 1 head Bibb lettuce, or more as needed",30 mins,4,2 hrs,2023-07-08T09:28:37Z
https://www.allrecipes.com/recipe/238423/dads-creamy-cucumber-salad/,Dad&#39;s Creamy Cucumber Salad,2 hrs,This creamy cucumber salad pairs crisp cucumber slices with a creamy mayo and vinegar dressing. It&#39;s sure to be a family-favorite this summer!,"Step1: Mix cucumbers, onion, and salt together in a bowl. Cover with plastic wrap and let sit for 15 to 30 minutes. Step2: Turn cucumber mixture into a colander set over a bowl or in a sink. Let drain, stirring occasionally, until most of the liquid and salt has drained, 15 to 30 minutes. Transfer drained cucumber mixture to a large bowl. Step3: Whisk mayonnaise, vinegar, sugar, dill, garlic powder, and pepper for dressing together in a bowl until smooth. Pour over cucumber mixture and stir until coated. Step4: Pour over cucumber mixture and stir until coated. Step5: Cover with plastic wrap and refrigerate for 1 to 2 hours before serving. Step6: Enjoy!",https://imagesvc.meredithcorp.io/v3/mm/image?url=https%3A%2F%2Fpublic-assets.meredithcorp.io%2F6d56b88ec6fb45a1c16a8fba755ce7d1%2F16615479077D97C2C6-31B3-4A56-9B66-B79EB134A930.jpeg,"2 large cucumbers, peeled and thinly sliced, 1 sweet onion, thinly sliced, 1 tablespoon sea salt, 1.5 cups mayonnaise, or more to taste, 2 tablespoons vinegar, 1 tablespoon white sugar, 1 teaspoon dried dill weed, 1 teaspoon garlic powder, 1 teaspoon ground black pepper",10 mins,8,2 hrs 10 mins,2023-07-08T09:28:56Z
https://www.allrecipes.com/recipe/14469/jamies-cranberry-spinach-salad/,Jamie&#39;s Cranberry Spinach Salad,5 mins,"This spinach salad is packed with fresh spinach, toasted almonds, and dried cranberries tossed with a sweet and tangy homemade sesame seed dressing.","Step1: Melt butter in a medium saucepan over medium heat. Cook and stir almonds in butter until lightly toasted. Remove from heat and let cool. Step2: Make dressing: Whisk together oil, sugar, cider vinegar, white wine vinegar, sesame seeds, poppy seeds, minced onion, and paprika in a medium bowl. Step3: Combine spinach with toasted almonds and cranberries in a large serving bowl. Pour dressing over spinach mixture; toss well.",https://imagesvc.meredithcorp.io/v3/mm/image?url=https%3A%2F%2Fimages.media-allrecipes.com%2Fuserphotos%2F8901847.jpg,"1 tablespoon butter, 0.75 cup almonds, blanched and slivered, 1 pound spinach, rinsed and torn into bite-size pieces, 1 cup dried cranberries, 0.5 cup vegetable oil, 0.5 cup white sugar, 0.25 cup cider vinegar, 0.25 cup white wine vinegar, 2 tablespoons toasted sesame seeds, 1 tablespoon poppy seeds, 2 teaspoons minced onion, 0.25 teaspoon paprika",10 mins,8,15 mins,2023-07-08T09:29:30Z
https://www.allrecipes.com/recipe/8525642/red-pear-pomegranate-and-gorgonzola-salad/,"Red Pear, Pomegranate, and Gorgonzola Salad",25 mins,"Red pears, pomegranate arils, Gorgonzola cheese, toasted walnuts and a simple vinaigrette top Romaine lettuce for a delicious salad.","Step1: Combine apple cider vinegar, extra-virgin olive oil, honey, Dijon mustard, salt, and white pepper in a small container with a lid. Cover tightly and shake until well combined. Set aside. Step2: Place lettuce in a salad bowl. Sprinkle with toasted walnut pieces and cheese crumbles. Fan pear slices on the top of the salad and sprinkle with pomegranate arils and chopped scallion. Step3: Drizzle with vinaigrette and serve.",https://www.allrecipes.com/thmb/DACnrMJpOE3qibnX-LMOyiKNJGU=/282x188/filters:no_upscale():max_bytes(150000):strip_icc():focal(719x0:721x2):format(webp)/4529365-9831150cb32148d6a6cd0cc49f780861.jpg,"3 tablespoons apple cider vinegar, 2 tablespoons extra-virgin olive oil, 1 tablespoon honey, 1 teaspoon Dijon mustard, 1 pinch salt, 1 pinch ground white pepper, 6 cups romaine lettuce - torn, washed and dried, 0.33 cup chopped toasted walnuts, 0.25 cup crumbled Gorgonzola cheese, 1 red pear, cored and sliced, 0.25 cup pomegranate arils, 1 green onion, chopped",25 mins,6,25 mins,2023-07-08T09:29:42Z
https://www.allrecipes.com/recipe/14172/caesar-salad-supreme/,Best Homemade Caesar Salad Dressing,15 mins,"This Caesar salad dressing recipe uses mayo, anchovies, garlic, lemon, and Parmesan for a rich, creamy taste that&#39;s so much better than store-bought.","Step1: Gather all ingredients. Step2: Mince 3 cloves of garlic and place in a small bowl. Add mayonnaise, 2 tablespoons grated Parmesan cheese, anchovies, lemon juice, Worcestershire sauce, and mustard; mix well to combine. Season to taste with salt and black pepper. Refrigerate until ready to use. Step3: Heat oil in a large skillet over medium heat. Slice remaining 3 cloves of garlic into quarters and add to hot oil. Cook and stir until brown, then remove garlic from pan. Cook bread cubes in hot flavored oil, turning frequently, until lightly browned; transfer onto a plate and season with salt and pepper. Step4: Place lettuce in a large bowl. Add dressing, remaining Parmesan cheese, and seasoned bread cubes; toss well to coat. Step5: Serve immediately and enjoy!",https://imagesvc.meredithcorp.io/v3/mm/image?url=https%3A%2F%2Fimages.media-allrecipes.com%2Fuserphotos%2F9379482.jpg,"6 cloves garlic, peeled, divided, 0.75 cup mayonnaise, 6 tablespoons grated Parmesan cheese, divided, 5 anchovy fillets, minced, 1 tablespoon lemon juice, or more to taste, 1 teaspoon Worcestershire sauce, 1 teaspoon Dijon mustard, salt and ground black pepper to taste, 0.25 cup olive oil, 4 cups day-old bread, cubed, 1 head romaine lettuce, torn into bite-sized pieces",20 mins,6,35 mins,2023-07-08T09:30:41Z
https://www.allrecipes.com/recipe/14295/seven-layer-salad/,Seven Layer Salad,10 mins,Make this 7-layer salad in a large glass bowl so dinner guests can see all the pretty layers and delicious ingredients. Everybody loves this salad!,"Step1: For the salad: Place bacon in a large skillet and cook over medium-high heat, turning occasionally, until evenly browned, about 10 minutes. Drain bacon slices on paper towels; crumble and set aside. Step2: Place chopped lettuce in a large glass dish or bowl; top with a layer of red onion, peas, shredded cheese, cauliflower, and bacon. Step3: For the dressing: Whisk mayonnaise, Parmesan cheese, and sugar together in a bowl until smooth. Drizzle over salad and refrigerate until chilled.",https://imagesvc.meredithcorp.io/v3/mm/image?url=https%3A%2F%2Fpublic-assets.meredithcorp.io%2F5efa9a3dc818caa95c2802c6109855d5%2F1681150889760image.jpg,"1 pound bacon, 1 large head iceberg lettuce - rinsed, dried, and chopped, 1 red onion, chopped, 1 (10 ounce) package frozen green peas, thawed, 10 ounces shredded Cheddar cheese, 1 cup chopped cauliflower, 1.25 cups mayonnaise, 0.66666668653488 cup grated Parmesan cheese, 2 tablespoons white sugar",15 mins,12,25 mins,2023-07-08T09:30:54Z
