url,title,cook,description,directions,images,ingredients,prep,servings,total,timestamp
https://www.allrecipes.com/recipe/73963/pasta-salad-with-homemade-dressing/,Pasta Salad with Homemade Dressing,15 mins,"A homemade Italian pasta salad dressing takes this simple pasta salad loaded with veggies, cheese, pepperoni, and olives to a whole new level! Perfect for weekday lunches or picnics.","Step1: Gather all ingredients. Step2: Bring a large pot of lightly salted water to a boil. Add rotini and cook until tender yet firm to the bite, 8 to 10 minutes. Drain, rinse with cold water, and drain again. Step3: Transfer drained, cooked pasta to a large bowl. Add pepperoni, provolone cheese, red onion, cucumber, bell peppers, olives, parsley, and Parmesan cheese. Step4: Mix olive oil, vinegar, garlic, basil, oregano, ground mustard, salt, and pepper for dressing in a jar with a lid. Seal the jar, and shake until well combined. Step5: Pour dressing over the pasta salad; toss until well coated. Serve immediately, or cover and chill in the refrigerator for up to 8 hours before serving.",https://imagesvc.meredithcorp.io/v3/mm/image?url=https%3A%2F%2Fpublic-assets.meredithcorp.io%2Fa6fdce81e1891c504cc07f24ea4b2122%2F1688241281708Pasta-Salad-Recipe.jpg,"1 (8 ounce) package uncooked tri-color rotini pasta, 6 ounces pepperoni sausage, diced, 6 ounces provolone cheese, cubed, 1 medium red onion, very thinly sliced and cut into 1-inch pieces, 1 small cucumber, thinly sliced, 0.75 cup chopped green bell pepper, 0.75 cup chopped red bell pepper, 1 (6 ounce) can pitted black olives, drained, 0.25 cup minced fresh parsley, 0.25 cup grated Parmesan cheese, 0.5 cup olive oil, 0.25 cup red wine vinegar, 2 cloves garlic, minced, 1 teaspoon dried basil, 1 teaspoon dried oregano, 0.5 teaspoon ground mustard seed, 0.25 teaspoon salt, 0.125 teaspoon ground black pepper",30 mins,8,45 mins,2023-07-08T09:23:04Z
https://www.allrecipes.com/recipe/8517237/tiktok-green-goddess-salad/,TikTok Green Goddess Salad,15 mins,"This bowl from the viral TikTok video from Baked by Melissa is just as delicious and scoop-able as it is in her video. The dressing is so tasty that we recommend mixing up an extra batch to use on grilled veggies, fish and even as a sauce for pizza!","Step1: Place the cabbage, cucumbers, and green onions in a large bowl. Set aside. Step2: Add garlic, shallot, lemon juice, chives, oil, vinegar, nuts, basil, spinach and yeast to the bowl of a food processor and blend, scraping down the sides occasionally, until smooth, about 1 minute. Step3: Pour dressing over cabbage and toss until well-combined. Season with salt and pepper, to taste.",https://www.allrecipes.com/thmb/IoUwMxryPsprc0V3whOceymJh9w=/75x75/filters:no_upscale():max_bytes(150000):strip_icc():format(webp)/sara-haas-dce67cd6a4ea498787a5cd03f526f8dd.jpg,"4 cups finely chopped green cabbage, 3 mini cucumbers, chopped, 5 scallions (green onions), trimmed and sliced, 2 cloves garlic, peeled, 1 shallot, peeled, 0.25 cup lemon juice, 0.25 cup chives, 0.25 cup extra-virgin olive oil, 2 tablespoons rice vinegar, 0.25 cup nuts (walnuts, cashews, almonds, etc.), 1 cup fresh basil, 1 cup baby spinach, 2 tablespoons nutritional yeast, salt and freshly ground black pepper to taste","Place the cabbage, cucumbers, and green onions in a large bowl. Set aside.",8,15 mins,2023-07-08T09:24:06Z
https://www.allrecipes.com/recipe/218225/greek-couscous/,Greek Couscous Salad,5 mins,"This Greek couscous salad with garbanzo beans, feta cheese, sun-dried tomatoes, and olives is hearty and delicious. Perfect for a hot summer&#39;s day.","Step1: Pour water and chicken broth into a saucepan; stir in the garlic and bring to a boil. Stir in pearl couscous, cover the pan, and remove from heat. Allow couscous to stand until water has been absorbed, about 5 minutes; fluff with a fork. Allow couscous to cool to warm temperature. Step2: Lightly toss couscous, chickpeas, sun-dried tomatoes, olives, and feta cheese in a large serving bowl. Step3: To make the dressing: Mix white wine vinegar, lemon juice, oregano, and black pepper in a small bowl until well combined. Pour over couscous mixture; toss again to serve.",https://imagesvc.meredithcorp.io/v3/mm/image?url=https%3A%2F%2Fpublic-assets.meredithcorp.io%2F6c5c61948b94da24b5e6272be67effec%2F1648955196A34CCED9-4EBD-4AF8-8D13-34AD62A55817.jpeg,"0.5 cup water, 0.25 cup chicken broth, 1 teaspoon minced garlic, 0.5 cup pearl (Israeli) couscous, 1 cup canned garbanzo beans, rinsed and drained, 0.25 cup chopped sun-dried tomatoes, 0.25 cup sliced Kalamata olives, 2 tablespoons crumbled feta cheese, 1 tablespoon white wine vinegar, 1.5 teaspoons lemon juice, 1 teaspoon dried oregano, 0.5 teaspoon ground black pepper",20 mins,3,45 mins,2023-07-08T09:24:14Z
https://www.allrecipes.com/recipe/8530011/green-goddess-salad/,Green Goddess Salad,20 mins,"A simple romaine salad topped with classic green goddess dressing made with mayonnaise, parsley, spinach, basil, tarragon, and, lemon juice.","Step1: Combine spinach, parsley, basil, chives, tarragon, shallot, garlic, anchovy paste, and lime juice in a high-powered blender; blend and slowly add oil through top opening of blender until mixture is smooth, about 1 minute, scraping down sides if needed. Add mayonnaise and salt; blend until smooth. Cover and chill until ready to serve. Step2: Combine cabbage, romaine, cucumber, and scallions in a large bowl; add 2/3 cup of the dressing and toss to evenly coat. Divide between 4 bowls and top each bowl with avocado and 1 tablespoon of the pistachios. Serve immediately with remaining dressing.",https://www.allrecipes.com/thmb/xoKWnU_nkf2evuoBiiREnW58IYs=/75x75/filters:no_upscale():max_bytes(150000):strip_icc():format(webp)/julia-levy-374ef21e61554af197b52367ec52b28e.jpg,"1 cup baby spinach, 1 cup coarsely chopped fresh flat-leaf parsley, 0.33 cup loosely packed fresh basil leaves, 3 tablespoons chopped fresh chives, 2 tablespoons coarsely chopped tarragon leaves, 0.5 medium shallot, peeled, coarsely chopped, 1 small garlic clove, peeled and chopped, 0.5 teaspoon anchovy paste, 0.25 cup fresh lime juice (from 2 medium limes), 6 tablespoons olive oil, 0.5 cup mayonnaise, 0.75 teaspoon kosher salt, 4 cups chopped green cabbage, 4 cups chopped hearts of romaine, 3 medium Persian cucumbers, sliced, 0.5 cup thinly sliced green onions, 1 medium ripe avocado, peeled and chopped, 0.25 cup chopped roasted, salted pistachios","Combine spinach, parsley, basil, chives, tarragon, shallot, garlic, anchovy paste, and lime juice in a high-powered blender; blend and slowly add oil through top opening of blender until mixture is smooth, about 1 minute, scraping down sides if needed. Add mayonnaise and salt; blend until smooth. Cover and chill until ready to serve.",4,20 mins,2023-07-08T09:24:22Z
https://www.allrecipes.com/recipe/8533611/hearts-of-palm-and-avocado-salad/,Hearts of Palm and Avocado Salad,15 mins,"Try this delicious hearts of palm salad with avocado, vegetables, and a simple lime dressing.","Step1: Peel the hearts of palm into strips lengthwise and cut the pile of strips in half. Set aside. Step2: Combine lime juice and vinegar in a small bowl and whisk in olive oil to combine. Season with chili powder and salt and set aside. Step3: Combine onion, bell pepper, radish, carrots, tomato, serrano, cilantro, and reserved vinaigrette in a medium bowl; stir to combine. Gently fold in avocado and hearts of palm. Serve immediately.",https://www.allrecipes.com/thmb/bTp96bLWnN7r28uyGH0YEbH47rM=/75x75/filters:no_upscale():max_bytes(150000):strip_icc():format(webp)/nicole-mclaughlin-portrait-129b390897334dedad8bf1ae0fc22633.jpg,"2 (14 ounce) cans whole hearts of palm, drained, 1 lime, juiced, 1.5 teaspoons red wine vinegar, 0.25 cup extra-virgin olive oil, 0.5 teaspoon chili powder, 0.75 teaspoon kosher salt, 0.5 cup thinly sliced sweet onion, 0.5 cup chopped red bell pepper, 0.5 cup matchstick-cut radishes, 0.333 cup matchstick-cut carrots, 0.25 cup chopped tomato, 1 serrano chile pepper, seeded and minced, 0.25 cup chopped fresh cilantro, 1 avocado, diced",15 mins,4,15 mins,2023-07-08T09:24:31Z
https://www.allrecipes.com/recipe/8527062/california-spaghetti-salad/,California Spaghetti Salad,10 mins,A delicious pasta salad full of vegetables and topped with goat cheese and almonds. Feel free to change up veggie quantities to your liking.,"Step1: Whisk together white wine vinegar, lemon juice, Parmesan cheese, Italian seasoning, honey, garlic, Dijon mustard, basil, salt, and pepper in a small bowl until well combined. Gradually mix in olive oil, whisking constantly. Set dressing aside. Step2: Bring a large pot of lightly salted water to a boil. Cook spaghetti in the boiling water, stirring occasionally, until tender yet firm to the bite, about 12 minutes. Step3: While spaghetti cook, prepare all the vegetables. Combine spinach, broccoli, peas, carrot, red onion, cucumber, and tomato in a large bowl. Step4: Drain pasta, and add to the bowl with the vegetables. Toss pasta and veggies together. Pour dressing over pasta and veggies and toss until thoroughly combined. Add in goat cheese and almonds and toss again to combine. Step5: Cover pasta, and chill in the fridge for at least 3 hours to overnight. Taste pasta salad, and season with more salt and pepper, if necessary.",https://www.allrecipes.com/thmb/eXh_13U0BGf3jO5RK3LdYrlAcdQ=/282x188/filters:no_upscale():max_bytes(150000):strip_icc():focal(479x0:481x2):format(webp)/9048640-7cbbeec28d2e4b34b25c7382d750701a.jpg,"2 tablespoons white wine vinegar, 2 tablespoons freshly squeezed lemon juice, 2 tablespoons freshly grated Parmesan cheese, 2.5 teaspoons Italian seasoning, 1.5 teaspoons honey, 1 clove minced garlic, 1 teaspoon Dijon mustard, 1 teaspoon dried basil, 0.25 teaspoon salt, 0.25 teaspoon freshly ground black pepper, 0.33 cup olive oil, 1 pound thin spaghetti, 1 cup baby spinach, rinsed and dried, 1 cup chopped broccoli, 1 cup frozen peas, 1 carrot, grated, 0.5 red onion, thinly sliced, 0.5 cucumber, peeled and thinly sliced, 1 Roma tomato, diced, 4 ounces crumbled goat cheese, or to taste, 0.25 cup toasted sliced almonds, or to taste, salt and freshly ground black pepper to taste",15 mins,4,3 hrs 25 mins,2023-07-08T09:24:43Z
https://www.allrecipes.com/recipe/147103/delicious-egg-salad-for-sandwiches/,Delicious Egg Salad for Sandwiches,15 mins,"This egg salad is quick to prep and easy to make with hard-cooked eggs, mayonnaise, mustard, paprika, and green onions. Perfect for sandwiches!","Step1: Place eggs in a saucepan and cover with cold water. Bring water to a boil and immediately remove from heat. Cover and let eggs stand in hot water for 10 to 12 minutes. Remove from hot water, cool, peel, and chop. Step2: Place chopped eggs in a bowl; stir in mayonnaise, green onion, and mustard. Season with paprika, salt, and pepper. Stir and serve on your favorite bread or crackers.",https://imagesvc.meredithcorp.io/v3/mm/image?url=https%3A%2F%2Fpublic-assets.meredithcorp.io%2F4d7ac7cc60e33ca161ab17bf01b491f2%2F167916781876716791678004352448040592925240922.jpg,"8 eggs, 0.5 cup mayonnaise, 0.25 cup chopped green onion, 1 teaspoon prepared yellow mustard, 0.25 teaspoon paprika, salt and pepper to taste",10 mins,4,35 mins,2023-07-08T09:25:01Z
https://www.allrecipes.com/recipe/228283/ham-salad-spread/,Ham Salad,15 mins,"This ham salad with hard-boiled eggs, mayo, mustard, and sweet pickle relish is delicious on crackers and quick to whip up for a party or holiday gathering!","Step1: Mix ham, eggs, celery, pickle relish, and onion together in a medium bowl until combined. Step2: Mix mayonnaise and mustard together in a small bowl; add to ham mixture and stir to coat. Step3: Refrigerate until ready to serve.",https://imagesvc.meredithcorp.io/v3/mm/image?url=https%3A%2F%2Fpublic-assets.meredithcorp.io%2F0bb1a05dd09c5991b090c96dd35d4c9d%2F1656442552image.jpg,"3 cups ground fully cooked ham, 2 hard cooked eggs, chopped, 2 tablespoons finely chopped celery, 4 teaspoons sweet pickle relish, 2 teaspoons finely chopped onion, 1 cup mayonnaise, 1 tablespoon prepared yellow mustard",15 mins,12,15 mins,2023-07-08T09:25:44Z
https://www.allrecipes.com/recipe/14452/green-salad/,Green Salad,15 mins,"This green salad is hearty, vibrant, and easy to make. With assorted greens, veggies, and deli meat — this versatile salad is a meal in itself!","Step1: Place onion and bell pepper in a microwave-safe bowl; heat in microwave on high until soft, about 1 to 2 minutes. Set aside to cool. Step2: Combine onion, bell pepper, salad greens, deli meat, and tomato in a large salad bowl. Sprinkle with onion powder, garlic powder, salt, and black pepper; toss well to mix. Step3: Pour on salad dressing; toss well and serve.",https://imagesvc.meredithcorp.io/v3/mm/image?url=https%3A%2F%2Fimages.media-allrecipes.com%2Fuserphotos%2F8220583.jpg,"0.5 cup chopped onion, 0.5 cup chopped green bell pepper, 2 (10 ounce) packages mixed salad greens, 4 thinly sliced chicken deli meat, chopped, 1 tomato, chopped, 0.25 teaspoon onion powder, 3 dashes garlic powder, 2 pinches salt and ground black pepper to taste, 3 tablespoons balsamic vinaigrette salad dressing",15 mins,8,30 mins,2023-07-08T09:25:53Z
https://www.allrecipes.com/recipe/86353/simple-pasta-salad/,Simple Pasta Salad,15 mins,"An easy pasta salad with Italian dressing, fresh veggies, and a sprinkle of cheese. The perfect simple yet yummy dish to bring to a picnic or potluck.","Step1: Gather all ingredients. Step2: Bring a large pot of lightly salted water to a boil. Place pasta in the pot, cook for 8 to 12 minutes, until al dente, and drain. Step3: Toss cooked pasta with Italian dressing, cucumbers, tomatoes, and green onions in a large bowl. Mix Parmesan cheese and Italian seasoning in a small bowl, and gently mix into the salad. Step4: Mix Parmesan cheese and Italian seasoning in a small bowl, and gently mix into the salad. Cover, and refrigerate for at least 30 minutes before serving. Step5: Enjoy!",https://imagesvc.meredithcorp.io/v3/mm/image?url=https%3A%2F%2Fimages.media-allrecipes.com%2Fuserphotos%2F9263031.jpg,"1 (16 ounce) package uncooked rotini pasta, 1 (16 ounce) bottle Italian salad dressing, 2 cucumbers, chopped, 6 tomatoes, chopped, 1 bunch green onions, chopped, 4 ounces grated Parmesan cheese, 1 tablespoon Italian seasoning",15 mins,12,1 hr,2023-07-08T09:26:08Z
https://www.allrecipes.com/recipe/59318/amish-slaw/,Best Vinegar Coleslaw,5 mins,This vinegar coleslaw recipe is made with an easy vinegar-based dressing instead of mayo for a tangy sweet side that&#39;s perfect for BBQs and picnics.,"Step1: Toss cabbage and onion together in a large bowl; set aside. Step2: Combine sugar, vinegar, oil, celery seed, salt, mustard, and pepper in a small saucepan; bring to a boil and simmer, stirring frequently, until sugar is dissolved, about 3 minutes. Let mixture cool slightly, about 5 minutes, then pour over cabbage mixture; toss well to coat. Cover and refrigerate at least 2 hours. ",https://imagesvc.meredithcorp.io/v3/mm/image?url=https%3A%2F%2Fimages.media-allrecipes.com%2Fuserphotos%2F7901550.jpg,"1 medium head cabbage, cored and shredded, 1 medium onion, finely chopped, 1 cup white sugar, 1 cup vinegar, 0.75 cup vegetable oil, 1 teaspoon celery seed, 1 teaspoon salt, 1 teaspoon prepared mustard, 1/4 teaspoon black pepper",15 mins,8,2 hrs 20 mins,2023-07-08T09:26:19Z
https://www.allrecipes.com/recipe/222750/quick-italian-pasta-salad/,Quick Italian Pasta Salad,10 mins,"This flavorful Italian pasta salad with salami, bell peppers, red onion, olives, and fresh mozzarella comes together quickly and is sure to be a hit!","Step1: Bring a large pot of lightly salted water to a boil. Cook rotini pasta at a boil until tender yet firm to the bite, about 8 minutes. Drain and rinse with cold water until cool. Step2: Combine pasta, salami, bell peppers, onion, mozzarella balls, and olives in a large bowl. Add salad dressing and toss to coat. Step3: Season pasta salad with dry salad dressing mix and stir to combine. Sprinkle with Parmesan cheese before serving.",https://imagesvc.meredithcorp.io/v3/mm/image?url=https%3A%2F%2Fimages.media-allrecipes.com%2Fuserphotos%2F9316868.jpg,"1 (12 ounce) package tri-color rotini pasta, 0.75 pound Italian salami, finely diced, 0.5 green bell pepper, sliced, 0.5 red bell pepper, sliced, 0.5 red onion, chopped, 1 (6 ounce) can sliced black olives, 8 ounces small fresh mozzarella balls (ciliegine), 1 cup Italian-style salad dressing, 3 (.7 ounce) packages dry Italian-style salad dressing mix, or to taste, 0.5 cup shredded Parmesan cheese",15 mins,12,25 mins,2023-07-08T09:26:32Z
https://www.allrecipes.com/watermelon-feta-and-mint-salad-recipe-7511300,"Celebrate Summer with Watermelon, Feta, and Mint Salad",15 mins,"This watermelon, feta, and mint salad is refreshing, loaded with sweet and salty flavors, and takes minutes to make. The quality of the olive oil and feta cheese is important, so go ahead and splurge a little.","Step1: Place the chilled watermelon cubes in a large bowl. Step2: Whisk olive oil, lemon juice, lemon zest, kosher salt, and black pepper together in a small bowl. Step3: Just before serving, drizzle dressing over chilled watermelon, and toss gently. Sprinkle feta cheese and mint over the watermelon, but do not mix in. Serve immediately.",https://www.allrecipes.com/thmb/FkpqCvwqZ_itLP9ggGWg0bM3WJk=/282x188/filters:no_upscale():max_bytes(150000):strip_icc():focal(3029x1258:3031x1260):format(webp)/cameron-diaz-goop-kitchen-salad-4x3-3fe249433d2346eeb88f710eecc785a3.jpg,"1 small watermelon (about 3 pounds), cut into 1-inch cubes and chilled, 1/4 cup extra virgin olive oil, 2 tablespoons freshly squeezed lemon juice, 1 teaspoon freshly grated lemon peel, 1/2 teaspoon kosher salt, freshly ground black pepper to taste, 4 ounces feta cheese, coarsely crumbled, 1/4 cup chopped fresh mint leaves",15 mins,4,15 mins,2023-07-08T09:26:54Z
https://www.allrecipes.com/recipe/14439/frog-eye-salad/,Frog Eye Salad,20 mins,"This frog eye salad is a sweet pasta salad with crushed pineapple, Mandarin oranges, coconut, and mini marshmallows in a creamy pineapple dressing.","Step1: Combine pineapple juice, sugar, eggs, flour, and 1/2 teaspoon salt in a saucepan. Stir and cook over medium heat until thickened. Remove from heat; stir in lemon juice. Let cool to room temperature, about 1 hour. Step2: Bring a large pot of water to a boil; add oil and remaining 2 teaspoons salt. Add pasta and cook until al dente, 5 to 7 minutes. Drain and rinse under cold water. Step3: Combine cooked pasta, cooled egg mixture, mandarin oranges, pineapple tidbits, crushed pineapple, and whipped topping in a large bowl; mix well. Refrigerate until chilled, 8 hours to overnight. Step4: Before serving, add marshmallows and coconut; toss and serve.",https://imagesvc.meredithcorp.io/v3/mm/image?url=https%3A%2F%2Fimages.media-allrecipes.com%2Fuserphotos%2F4549239.jpg,"1.75 cups unsweetened pineapple juice, 1 cup white sugar, 2 eggs, beaten, 2 tablespoons all-purpose flour, 2.5 teaspoons salt, divided, 1 tablespoon lemon juice, 1 tablespoon vegetable oil, 1 (16 ounce) package acini di pepe pasta, 3 (11 ounce) cans mandarin oranges, drained, 2 (20 ounce) cans pineapple tidbits, drained, 1 (20 ounce) can crushed pineapple, drained, 1 (8 ounce) container frozen whipped topping, thawed, 1 cup miniature marshmallows, 1 cup shredded coconut",15 mins,10,9 hrs 35 mins,2023-07-08T09:27:04Z
https://www.allrecipes.com/recipe/16729/old-fashioned-potato-salad/,Old-Fashioned Potato Salad,15 mins,"This classic potato salad recipe makes a creamy potato salad with hard-boiled eggs, celery, and relish. Perfect for summer BBQs, picnics, or potlucks.","Step1: Gather all ingredients. Step2: Bring a large pot of salted water to a boil. Add potatoes and cook until tender but still firm, about 15 minutes. Step3: Drain, cool, peel, and chop potatoes. Step4: While potatoes cook, place eggs in a saucepan and cover with cold water. Bring water to a boil; cover, remove from heat, and let eggs stand in hot water for 10 to 12 minutes. Step5: Remove from hot water, cool, peel, and chop eggs. Step6: Combine the potatoes, eggs, celery, onion, relish, mayonnaise, mustard, garlic salt, celery salt, and pepper in a large bowl. Mix together well and refrigerate until chilled. Step7: Enjoy!",https://imagesvc.meredithcorp.io/v3/mm/image?url=https%3A%2F%2Fpublic-assets.meredithcorp.io%2Fb505424140f0fc4ef04c3c6f0e32d88f%2F168342303756520230506_164316.jpg,"5 potatoes, 3 eggs, 1 cup chopped celery, 0.5 cup chopped onion, 0.5 cup sweet pickle relish, 0.25 cup mayonnaise, 1 tablespoon prepared mustard, 0.25 teaspoon garlic salt, 0.25 teaspoon celery salt, ground black pepper to taste",15 mins,8,1 hr,2023-07-08T09:27:26Z
https://www.allrecipes.com/recipe/74083/grilled-asparagus-salad/,Grilled Asparagus Salad,5 mins,"This asparagus salad with tender-crisp grilled asparagus spears, spinach, Parmesan, and almonds makes a quick and tasty addition to any outdoor summer meal.","Step1: Preheat an outdoor grill for low heat and lightly oil the grate. Step2: Combine oil and lemon juice in a baking dish. Add asparagus and roll until coated. Step3: Grill asparagus on the preheated grill, turning at least once and brushing with remaining oil-lemon juice mixture, until crisp-tender, about 5 minutes. Remove from the grill and place back into the baking dish. Cut into bite-sized pieces. Step4: Combine spinach, Parmesan, and almonds in a large bowl. Add asparagus along with any oil-lemon juice mixture from the dish. Toss to blend and serve immediately.",https://imagesvc.meredithcorp.io/v3/mm/image?url=https%3A%2F%2Fimages.media-allrecipes.com%2Fuserphotos%2F2980068.jpg,"0.25 cup olive oil, 2 tablespoons lemon juice, 12 fresh asparagus spears, 6 cups fresh spinach leaves, 2 tablespoons grated Parmesan cheese, 1 tablespoon seasoned slivered almonds",10 mins,6,15 mins,2023-07-08T09:27:35Z
https://www.allrecipes.com/recipe/237284/creamy-avocado-chicken-salad/,Creamy Avocado Chicken Salad,10 mins,"This refreshing avocado chicken salad comes together quickly by blending cooked chicken, avocado, sour cream, black pepper, garlic, and lime juice.","Step1: Place chicken in a food processor; process until finely chopped. Add avocado, sour cream, black pepper, lime juice, garlic powder, onion powder, and salt; blend until smooth (or the consistency you desire).",https://imagesvc.meredithcorp.io/v3/mm/image?url=https%3A%2F%2Fimages.media-allrecipes.com%2Fuserphotos%2F4682370.jpg,"2 cooked chicken breast halves, diced, 1 ripe avocado, sliced, 0.5 cup sour cream, 1.5 teaspoons ground black pepper, 1 teaspoon lime juice, 0.5 teaspoon garlic powder, 0.5 teaspoon onion powder, 0.25 teaspoon salt",10 mins,4,10 mins,2023-07-08T09:27:55Z
https://www.allrecipes.com/recipe/8453629/caprese-pasta-with-thai-basil/,Caprese Pasta with Thai Basil,15 mins,Try this light summery caprese pasta with Thai basil and lemon flavored balsamic vinegar for lunch on a hot day.,"Step1: Bring a large pot of lightly salted water to a boil. Cook spaghetti in the boiling water, stirring occasionally, until tender yet firm to the bite, about 12 minutes. Step2: Combine cherry tomatoes, mozzarella balls, olive oil, balsamic vinegar, garlic, and Thai basil in a large mixing bowl; mix well. Season with salt and pepper to taste. Step3: Drain pasta and top with cherry tomato mixture.",https://www.allrecipes.com/thmb/xwW-gEc1Hai9fpH7l3Lsb5yEHs4=/282x188/filters:no_upscale():max_bytes(150000):strip_icc():focal(479x0:481x2):format(webp)/1106402-angel-hair-pasta-with-shrimp-and-basil-Deb-C-1x1-1-a55c3e30c7c34ddaa704b312f3929582.jpg,"1 pound spaghetti, 1.5 cups cherry tomatoes, halved, 0.5 cup olive oil, 3 tablespoons lemon-infused white balsamic vinegar, 2 cloves garlic, chopped, 0.33 cup chopped Thai basil, 1 (8 ounce) container small mozzarella balls in oil, halved, salt and freshly ground black pepper to taste",15 mins,4,30 mins,2023-07-08T09:28:12Z
https://www.allrecipes.com/recipe/229063/classic-restaurant-caesar-salad/,Classic Caesar Salad,20 mins,"This Caesar salad is surprisingly easy to make with a delicious homemade Caesar dressing, croutons, and Parmesan cheese for a restaurant-quality dish.","Step1: Gather all ingredients. Step2: To make the dressing: Mash anchovy fillets and garlic in a large salad bowl. Add lemon juice, red wine vinegar, Dijon mustard, egg yolk, and Worcestershire sauce; whisk until smooth and creamy. Gradually stream in olive oil while whisking constantly. Season with salt and black pepper. Step3: Make salad: Gently mix romaine lettuce and Parmesan cheese into dressing until thoroughly coated. Step4: Serve salad topped with croutons.",https://imagesvc.meredithcorp.io/v3/mm/image?url=https%3A%2F%2Fimages.media-allrecipes.com%2Fuserphotos%2F7035059.jpg,"3 anchovy fillets, 2 cloves garlic, finely chopped, 0.5 lemon, juiced, 2 tablespoons red wine vinegar, 1 large egg yolk, 1 tablespoon Dijon mustard, 1 dash Worcestershire sauce, 0.25 cup olive oil, salt and ground black pepper to taste, 0.5 head romaine lettuce, chopped, 0.25 cup grated Parmesan cheese, 2 tablespoons croutons",20 mins,2,20 mins,2023-07-08T09:28:21Z
